matching_text,granturls,funder,funding_type,closing_date,opening_date,publication_date,total_fund,titles,status,Clinical_Trials
['data sharing'],https://grants.nih.gov/grants/guide/pa-files/PA-19-082.html,,,1/8/2022,11/26/2018,,,"Novel approaches to understand, prevent, treat, and diagnose coccidioidomycosis (Valley Fever) and other select endemic fungal infections (R01 Clinical Trial Not Allowed)",,Not_Allowed
['data sharing'],https://grants.nih.gov/grants/guide/pa-files/PA-18-946.html,,,1/8/2022,10/1/2018,,,Applying a Biopsychosocial Perspective to Self-Management of Chronic Pain (R21 Clinical Trial Optional),,Optional
['data sharing'],https://grants.nih.gov/grants/guide/pa-files/PA-19-081.html,,,1/8/2022,11/26/2018,,,Advancing Development of Rapid Fungal Diagnostics (R21 Clinical Trial Not Allowed),,Not_Allowed
['data sharing'],https://grants.nih.gov/grants/guide/pa-files/PA-19-020.html,,,1/8/2022,10/5/2018,,,Fc-Dependent Mechanisms of Antibody-Mediated Killing (R21 Clinical Trial Not Allowed),,Not_Allowed
['data sharing'],https://grants.nih.gov/grants/guide/pa-files/PA-19-023.html,,,1/8/2022,10/12/2018,,,Addressing Caregiver Symptoms through Technological Tools (R01 Clinical Trial Optional),,Optional
['data sharing'],https://grants.nih.gov/grants/guide/pa-files/PA-19-024.html,,,1/8/2022,10/12/2018,,,Addressing Caregiver Symptoms through Technological Tools (R21 Clinical Trial Optional),,Optional
['data sharing'],https://grants.nih.gov/grants/guide/pa-files/PA-19-046.html,,,1/8/2022,10/31/2018,,,Advancing Research in Augmentative and Alternative Communication (AAC) (R21 Clinical Trial Optional),,Optional
['data sharing'],https://grants.nih.gov/grants/guide/pa-files/PA-19-047.html,,,1/8/2022,10/31/2018,,,Advancing Research in Augmentative and Alternative Communication (AAC) (R01 Clinical Trial Optional),,Optional
['data sharing'],https://grants.nih.gov/grants/guide/pa-files/PA-19-049.html,,,1/8/2022,11/1/2018,,,New Research Directions that Advance the NHLBI Strategic Vision  Normal Biology (R21 - Clinical Trial Not Allowed),,Not_Allowed
['data sharing'],https://grants.nih.gov/grants/guide/pa-files/PA-19-065.html,,,1/8/2022,11/13/2018,,,"Medical Simulators for Practicing Patient Care Providers  Skill Acquisition, Outcomes Assessment and Technology Development (R01 Clinical Trial Not Allowed)",,Not_Allowed
['data sharing'],https://grants.nih.gov/grants/guide/pa-files/PA-19-066.html,,,1/8/2022,11/13/2018,,,Processing and Presentation of Non-Conventional MHC Ligands (R21 Clinical Trial Not Allowed),,Not_Allowed
['data sharing'],https://grants.nih.gov/grants/guide/pa-files/PA-19-067.html,,,1/8/2022,11/13/2018,,,Processing and Presentation of Non-Conventional MHC Ligands (R01 Clinical Trial Not Allowed),,Not_Allowed
['data sharing'],https://grants.nih.gov/grants/guide/pa-files/PA-19-073.html,,,1/8/2022,11/20/2018,,,Telomeres in Wellness and Disease: A Biobehavioral Approach  (R21 Clinical Trial Optional),,Optional
['data sharing'],https://grants.nih.gov/grants/guide/pa-files/PA-19-074.html,,,1/8/2022,11/20/2018,,,Telomeres in Wellness and Disease: A Biobehavioral Approach (R01 Clinical Trial Optional),,Optional
['data sharing'],https://grants.nih.gov/grants/guide/pa-files/PA-19-075.html,,,1/6/2022,11/26/2018,,,Enabling Technologies to Accelerate Development of Oral Biodevices (R41/R42 Clinical Trial Not Allowed),,Not_Allowed
['data sharing'],https://grants.nih.gov/grants/guide/pa-files/PA-19-076.html,,,1/6/2022,11/26/2018,,,Enabling Technologies to Accelerate Development of Oral Biodevices (R43/R44 Clinical Trial Not Allowed),,Not_Allowed
['data sharing'],https://grants.nih.gov/grants/guide/pa-files/PA-19-077.html,,,1/8/2022,11/26/2018,,,Accelerating Malaria Vaccine Discovery (R01 Clinical Trial Not Allowed),,Not_Allowed
['data sharing'],https://grants.nih.gov/grants/guide/pa-files/PA-19-080.html,,,1/8/2022,11/26/2018,,,Advancing Development of Rapid Fungal Diagnostics (R01 Clinical Trial Not Allowed),,Not_Allowed
['data sharing'],https://grants.nih.gov/grants/guide/pa-files/PAR-19-144.html,,,1/8/2022,12/28/2018,,,NIDCR Dual Degree Dentist Scientist Pathway to Independence Award (K99/R00 Independent Clinical Trial Not Allowed),,Not_Allowed
['data sharing'],https://grants.nih.gov/grants/guide/pa-files/PAR-19-146.html,,,1/8/2022,1/8/2019,,,Drug Discovery For Nervous System Disorders (R21 Clinical Trial Not Allowed),,Not_Allowed
['data sharing'],https://grants.nih.gov/grants/guide/pa-files/PAR-20-092.html,,,9/2/2022,1/24/2020,,,Development of Medications to Prevent and Treat Opioid Use Disorders and Overdose (UG3/UH3) (Clinical Trial Optional),,Optional
['data sharing'],https://grants.nih.gov/grants/guide/pa-files/PAR-19-368.html,,,1/8/2022,9/9/2019,,,Accelerating the Pace of Drug Abuse Research Using Existing Data (R01 Clinical Trial Optional),,Optional
['data sharing'],https://grants.nih.gov/grants/guide/pa-files/PAR-19-372.html,,,11/9/2022,9/10/2019,,,Social Epigenomics Research Focused on Minority Health and Health Disparities (R01-Clinical Trial Not Allowed),,Not_Allowed
['data sharing'],https://grants.nih.gov/grants/guide/pa-files/PAR-19-374.html,,,9/26/2022,9/13/2019,,,Complex Integrated Multi-Component Projects in Aging Research (U19 Clinical Trial Optional),,Optional
['data sharing'],https://grants.nih.gov/grants/guide/pa-files/PAR-19-377.html,,,1/8/2023,9/13/2019,,,Omics-guided Biobehavioral Interventions for Improved Health Outcomes: A Step Forward in Translation (R01 Clinical Trial Optional),,Optional
['data sharing'],https://grants.nih.gov/grants/guide/pa-files/PAR-19-378.html,,,9/8/2022,9/16/2019,,,"Bioinformatics Interdisciplinary Predoctoral Fellowship in Diabetes, Endocrinology and Metabolic Diseases (F31)",,Not_Allowed
['data sharing'],https://grants.nih.gov/grants/guide/pa-files/PAR-19-379.html,,,9/8/2022,9/16/2019,,,"Bioinformatics Interdisciplinary Postdoctoral Fellowship in Diabetes, Endocrinology and Metabolic Diseases (F32)",,Not_Allowed
['data sharing'],https://grants.nih.gov/grants/guide/pa-files/PAR-19-380.html,,,9/26/2022,9/17/2019,,,Initiative to Maximize Research Education in Genomics:  Diversity Action Plan (R25),,Not_Allowed
['data sharing'],https://grants.nih.gov/grants/guide/pa-files/PAR-19-381.html,,,5/8/2023,9/17/2019,,,Patient Activation for Self-Management of Chronic Conditions (R01 Clinical Trial Optional),,Optional
['data sharing'],https://grants.nih.gov/grants/guide/pa-files/PAR-19-382.html,,,5/8/2023,9/17/2019,,,Patient Activation for Self-Management of Chronic Conditions (R21 Clinical Trial Optional),,Optional
['data sharing'],https://grants.nih.gov/grants/guide/pa-files/PAR-19-385.html,,,11/17/2021,9/30/2019,,,Environmental Risks for Psychiatric Disorders: Biological Basis of Pathophysiology (R21 Clinical Trial Not Allowed),,Not_Allowed
['data sharing'],https://grants.nih.gov/grants/guide/pa-files/PAR-19-386.html,,,11/17/2021,9/30/2019,,,Environmental Risks for Psychiatric Disorders: Biological Basis of Pathophysiology (R01 Clinical Trial Not Allowed),,Not_Allowed
['data sharing'],https://grants.nih.gov/grants/guide/pa-files/PAR-19-387.html,,,1/8/2023,10/2/2019,,,Perception and Cognition Research to Inform Cancer Image Interpretation (R01 Clinical Trial Optional),,Optional
['data sharing'],https://grants.nih.gov/grants/guide/pa-files/PAR-19-389.html,,,1/8/2023,10/2/2019,,,Perception and Cognition Research to Inform Cancer Image Interpretation (R21 Clinical Trial Optional),,Optional
['data sharing'],https://grants.nih.gov/grants/guide/pa-files/PAR-19-394.html,,,1/8/2023,10/18/2019,,,Aging Research Dissertation Awards to Increase Diversity (R36 Clinical Trial Not Allowed),,Not_Allowed
['data sharing'],https://grants.nih.gov/grants/guide/pa-files/PAR-20-026.html,,,9/16/2022,10/2/2019,,,Genetic Architecture of Mental Disorders in Ancestrally Diverse Populations (U01 Clinical Trial Not Allowed),,Not_Allowed
['data sharing'],https://grants.nih.gov/grants/guide/pa-files/PAR-20-029.html,,,1/8/2022,10/10/2019,,,Sustained Release of Antivirals for Treatment or Prevention of HIV (SRATP) (R01 Clinical Trial Not Allowed),,Not_Allowed
['data sharing'],https://grants.nih.gov/grants/guide/pa-files/PAR-19-371.html,,,1/8/2022,9/9/2019,,,NIAID Career Transition Award (K22 Independent Clinical Trial Not Allowed),,Not_Allowed
['data sharing'],https://grants.nih.gov/grants/guide/pa-files/PAR-19-367.html,,,5/18/2022,9/9/2019,,,Maximizing Investigators' Research Award (R35 - Clinical Trial Optional),,Optional
['data sharing'],https://grants.nih.gov/grants/guide/pa-files/PAR-20-032.html,,,12/21/2021,10/17/2019,,,Human-Animal Interaction (HAI) Research (R03 Clinical Trial Optional),,Optional
['data sharing'],https://grants.nih.gov/grants/guide/pa-files/PAR-19-365.html,,,9/8/2022,9/9/2019,,,Limited Competition: Small Grant Program for NIDDK K01/K08/K23/K25 Recipients (R03 Clinical Trial Optional),,Optional
['data sharing'],https://grants.nih.gov/grants/guide/pa-files/PAR-19-340.html,,,6/9/2022,8/12/2019,,,Leveraging Cognitive Neuroscience to Improve Assessment of Cancer Treatment-Related Cognitive Impairment (R01 Clinical Trial Optional),,Optional
['data sharing'],https://grants.nih.gov/grants/guide/pa-files/PAR-19-344.html,,,3/11/2022,8/14/2019,,,Explainable Artificial Intelligence for Decoding and Modulating Neural Circuit Activity Linked to Behavior (R01 Clinical Trial Optional),,Optional
['data sharing'],https://grants.nih.gov/grants/guide/pa-files/PAR-19-345.html,,,9/8/2022,8/16/2019,,,NIDA Program Project Grant Applications (P01 Clinical Trial Optional),,Optional
['data sharing'],https://grants.nih.gov/grants/guide/pa-files/PAR-19-348.html,,,6/9/2022,8/16/2019,,,Innovative Approaches to Studying Cancer Communication in the New Information Ecosystem (R01 Clinical Trial Optional),,Optional
['data sharing'],https://grants.nih.gov/grants/guide/pa-files/PAR-19-350.html,,,6/9/2022,8/16/2019,,,Innovative Approaches to Studying Cancer Communication in the New Information Ecosystem (R21 Clinical Trial Optional),,Optional
['data sharing'],https://grants.nih.gov/grants/guide/pa-files/PAR-19-352.html,,,9/8/2022,8/29/2019,,,Intervening with Cancer Caregivers to Improve Patient Health Outcomes and Optimize Health Care Utilization (R01 Clinical Trial Optional),,Optional
['data sharing'],https://grants.nih.gov/grants/guide/pa-files/PAR-19-353.html,,,5/28/2022,8/28/2019,,,Neural Regulation of Cancer (R01 Clinical Trial Not Allowed),,Not_Allowed
['data sharing'],https://grants.nih.gov/grants/guide/pa-files/PAR-19-354.html,,,5/28/2022,8/28/2019,,,Neural Regulation of Cancer (R21 Clinical Trial Not Allowed),,Not_Allowed
['data sharing'],https://grants.nih.gov/grants/guide/pa-files/PAR-19-355.html,,,9/8/2022,8/29/2019,,,Intervening with Cancer Caregivers to Improve Patient Health Outcomes and Optimize Health Care Utilization (R21 Clinical Trial Optional),,Optional
['data sharing'],https://grants.nih.gov/grants/guide/pa-files/PAR-19-357.html,,,1/11/2022,9/3/2019,,,Myeloid-Derived Suppressor Cells (MDSCs) as Potential Therapeutic Targets in TB/HIV (R01 Clinical Trial Not Allowed),,Not_Allowed
['data sharing'],https://grants.nih.gov/grants/guide/pa-files/PAR-19-358.html,,,9/8/2022,8/29/2019,,,Linking the Provider Recommendation to Adolescent HPV Vaccine Uptake  (R21 Clinical Trial Optional),,Optional
['data sharing'],https://grants.nih.gov/grants/guide/pa-files/PAR-19-359.html,,,7/17/2022,8/29/2019,,,Linking the Provider Recommendation to Adolescent HPV Vaccine Uptake  (R03 Clinical Trial Optional),,Optional
['data sharing'],https://grants.nih.gov/grants/guide/pa-files/PAR-19-360.html,,,9/8/2022,8/29/2019,,,Linking the Provider Recommendation to Adolescent HPV Vaccine Uptake  (R01 Clinical Trial Optional),,Optional
['data sharing'],https://grants.nih.gov/grants/guide/pa-files/PAR-19-361.html,,,3/12/2022,8/29/2019,,,Small-Cell Lung Cancer (SCLC) Consortium: Therapeutic Development and Mechanisms of Resistance (U01 Clinical Trial Not Allowed),,Not_Allowed
['data sharing'],https://grants.nih.gov/grants/guide/pa-files/PAR-19-364.html,,,1/11/2022,9/3/2019,,,Myeloid-Derived Suppressor Cells (MDSCs) as Potential Therapeutic Targets in TB/HIV (R21 Clinical Trial Not Allowed),,Not_Allowed
['data sharing'],https://grants.nih.gov/grants/guide/pa-files/PAR-20-031.html,,,12/21/2021,10/17/2019,,,Human-Animal Interaction (HAI) Research (R01 Clinical Trial Optional),,Optional
['data sharing'],https://grants.nih.gov/grants/guide/pa-files/PAR-20-033.html,,,12/21/2021,10/17/2019,,,Human-Animal Interaction (HAI) Research (R21 Clinical Trial Optional),,Optional
['data sharing'],https://grants.nih.gov/grants/guide/pa-files/PAR-19-338.html,,,7/6/2022,8/9/2019,,,"Limited Competition: Renewals of, and Revisions and Resubmissions to, the Longitudinal Early-onset Alzheimers Disease Study (LEADS) Cooperative Agreement (U01 Clinical Trial Not Allowed)",,Not_Allowed
['data sharing'],https://grants.nih.gov/grants/guide/pa-files/PAR-20-062.html,,,1/8/2023,11/22/2019,,,Co-infection and Cancer (R01 Clinical Trial Not Allowed),,Not_Allowed
['data sharing'],https://grants.nih.gov/grants/guide/pa-files/PAR-20-064.html,,,1/8/2023,11/25/2019,,,Archiving and Documenting Child Health and Human Development Data Sets (R03 Clinical Trial Not Allowed),,Not_Allowed
['data sharing'],https://grants.nih.gov/grants/guide/pa-files/PAR-20-065.html,,,1/8/2023,11/25/2019,,,Small Research Grants for Establishing Basic Science-Clinical Collaborations to Understand Structural Birth Defects (R03 Clinical Trial Not Allowed),,Not_Allowed
['data sharing'],https://grants.nih.gov/grants/guide/pa-files/PAR-20-066.html,,,1/28/2022,12/2/2019,,,Postbaccalaureate Research Education Program (R25 - Independent Clinical Trial Not Allowed),,Not_Allowed
['data sharing'],https://grants.nih.gov/grants/guide/pa-files/PAR-20-072.html,,,9/8/2022,12/9/2019,,,NIAID Investigator Initiated Program Project Applications (P01 Clinical Trial Not Allowed),,Not_Allowed
['data sharing'],https://grants.nih.gov/grants/guide/pa-files/PAR-20-073.html,,,9/2/2022,12/9/2019,,,National Dental Practice-Based Research Network Infrastructure Access (X01 Clinical Trial Not Allowed),,Not_Allowed
['data sharing'],https://grants.nih.gov/grants/guide/pa-files/PAR-20-074.html,,,10/29/2022,12/10/2019,,,Revision Applications for Validation of Biomarker Assays Developed Through NIH-Supported Research Grants (R01 Clinical Trial Not Allowed),,Not_Allowed
['data sharing'],https://grants.nih.gov/grants/guide/pa-files/PAR-20-075.html,,,1/8/2023,12/11/2019,,,Limited Competition: NIDDK Program Projects (P01 Clinical Trial Optional),,Optional
['data sharing'],https://grants.nih.gov/grants/guide/pa-files/PAR-20-077.html,,,5/8/2023,1/27/2020,,,National Cancer Institute Program Project Applications (P01 Clinical Trial Optional),,Optional
['data sharing'],https://grants.nih.gov/grants/guide/pa-files/PAR-20-078.html,,,11/26/2022,12/19/2019,,,"Secondary Analysis of Existing Datasets in Heart, Lung, and Blood Diseases and Sleep Disorders (R21 Clinical Trial Not Allowed)",,Not_Allowed
['data sharing'],https://grants.nih.gov/grants/guide/pa-files/PAR-20-079.html,,,7/6/2022,12/30/2019,,,Surgical Disparities Research (R01 - Clinical Trial Optional),,Optional
['data sharing'],https://grants.nih.gov/grants/guide/pa-files/PAR-20-081.html,,,4/2/2022,1/14/2020,,,Mechanisms of Disparities in Chronic Liver Diseases and Cancer (R21- Clinical Trial Not Allowed),,Not_Allowed
['data sharing'],https://grants.nih.gov/grants/guide/pa-files/PAR-20-082.html,,,1/8/2023,1/3/2020,,,Engineering Next-Generation Human Nervous System Microphysiological Systems (R21 Clinical Trials Not Allowed),,Not_Allowed
['data sharing'],https://grants.nih.gov/grants/guide/pa-files/PAR-20-083.html,,,4/11/2022,1/7/2020,,,Enhancing Regulatory Science for Advancing Pharmaceutical Quality and Manufacturing (U01) Clinical Trials Optional,,Optional
['data sharing'],https://grants.nih.gov/grants/guide/pa-files/PAR-20-088.html,,,4/2/2022,1/14/2020,,,Mechanisms of Disparities in Chronic Liver Diseases and Cancer (R01- Clinical Trial Not Allowed),,Not_Allowed
['data sharing'],https://grants.nih.gov/grants/guide/pa-files/PAR-20-090.html,,,11/2/2022,1/14/2020,,,NIAMS Clinical Trial Planning Grant (R34) - Clinical Trial Not Allowed,,Not_Allowed
['data sharing'],https://grants.nih.gov/grants/guide/pa-files/PAR-20-063.html,,,1/8/2023,11/22/2019,,,NIAID Resource-Related Research Projects (R24 Clinical Trial Not Allowed),,Not_Allowed
['data sharing'],https://grants.nih.gov/grants/guide/pa-files/PAR-20-061.html,,,1/8/2023,11/22/2019,,,Co-infection and Cancer (R21 Clinical Trial Not Allowed),,Not_Allowed
['data sharing'],https://grants.nih.gov/grants/guide/pa-files/PAR-20-034.html,,,1/8/2023,10/18/2019,,,Fundamental Mechanisms of Affective and Decisional Processes in Cancer Control (R01 Clinical Trial Optional),,Optional
['data sharing'],https://grants.nih.gov/grants/guide/pa-files/PAR-20-060.html,,,1/10/2023,11/19/2019,,,NIDCR Prospective Observational or Biomarker Validation Study Cooperative Agreement (U01 Clinical Trial Not Allowed),,Not_Allowed
['data sharing'],https://grants.nih.gov/grants/guide/pa-files/PAR-20-035.html,,,11/8/2022,10/18/2019,,,Integrative Research on Polysubstance Abuse and Disorder (R61/R33 Clinical Trial Optional),,Optional
['data sharing'],https://grants.nih.gov/grants/guide/pa-files/PAR-20-036.html,,,9/8/2022,10/24/2019,,,Getting To Zero: Understanding HIV Viral Suppression and Transmission in the United States (R01 Clinical Trial Optional),,Optional
['data sharing'],https://grants.nih.gov/grants/guide/pa-files/PAR-20-037.html,,,1/8/2023,1/7/2020,,,Development and Application of PET and SPECT Imaging Ligands as Biomarkers for Drug Discovery and for Pathophysiological Studies of CNS Disorders (R01 Clinical Trial Not Allowed),,Not_Allowed
['data sharing'],https://grants.nih.gov/grants/guide/pa-files/PAR-20-038.html,,,1/8/2023,1/7/2020,,,Development and Application of PET and SPECT Imaging Ligands as Biomarkers for Drug Discovery and for Pathophysiological Studies of CNS Disorders (R01 Clinical Trial Optional),,Optional
['data sharing'],https://grants.nih.gov/grants/guide/pa-files/PAR-20-042.html,,,4/1/2022,10/24/2019,,,NCMRR Early Career Research Award (R03 Clinical Trial Optional),,Optional
['data sharing'],https://grants.nih.gov/grants/guide/pa-files/PAR-20-045.html,,,1/8/2023,11/8/2019,,,NIDCR Research Grants for Analyses of Existing Genomics Data  (R01 Clinical Trial Not Allowed),,Not_Allowed
['data sharing'],https://grants.nih.gov/grants/guide/pa-files/PAR-20-046.html,,,1/8/2023,11/8/2019,,,NIDCR Small Research Grants for Analyses of Existing Genomics Data (R03 Clinical Trial Not Allowed),,Not_Allowed
['data sharing'],https://grants.nih.gov/grants/guide/pa-files/PAR-20-048.html,,,7/16/2022,11/6/2019,,,Building Population Health Research Capacity in the U.S. Affiliated Pacific Islands (U24  Clinical Trial Not Allowed),,Not_Allowed
['data sharing'],https://grants.nih.gov/grants/guide/pa-files/PAR-20-049.html,,,1/8/2023,11/7/2019,,,NINDS Postdoctoral Mentored Career Development Award (K01 No Independent Clinical Trial Allowed),,Not_Allowed
['data sharing'],https://grants.nih.gov/grants/guide/pa-files/PAR-20-050.html,,,1/8/2023,11/7/2019,,,NINDS Postdoctoral Mentored Career Development Award (K01 Clinical Trial Required),,Required
['data sharing'],https://grants.nih.gov/grants/guide/pa-files/PAR-20-051.html,,,10/1/2022,11/12/2019,,,NEI Center Core Grant for Vision Research (P30 Clinical Trial Not Allowed),,Not_Allowed
['data sharing'],https://grants.nih.gov/grants/guide/pa-files/PAR-20-052.html,,,1/8/2023,11/8/2019,,,"NCI Small Grants Program for Cancer Research for Years 2020, 2021, and 2022 (NCI Omnibus R03 Clinical Trial Optional)",,Optional
['data sharing'],https://grants.nih.gov/grants/guide/pa-files/PAR-20-055.html,,,1/8/2023,1/3/2020,,,Engineering Next-Generation Human Nervous System Microphysiological Systems (R01 Clinical Trials Not Allowed),,Not_Allowed
['data sharing'],https://grants.nih.gov/grants/guide/pa-files/PAR-20-058.html,,,1/8/2023,11/18/2019,,,Improving oral health and reducing disparities in adolescents (R01 Clinical Trial Not Allowed),,Not_Allowed
['data sharing'],https://grants.nih.gov/grants/guide/pa-files/PAR-20-059.html,,,1/8/2023,11/18/2019,,,Improving oral health and reducing disparities in adolescents (R21 Clinical Trial Not Allowed),,Not_Allowed
['data sharing'],https://grants.nih.gov/grants/guide/pa-files/PAR-19-339.html,,,6/9/2022,8/12/2019,,,Leveraging Cognitive Neuroscience to Improve Assessment of Cancer Treatment-Related Cognitive Impairment (R21 Clinical Trial Optional),,Optional
['data sharing'],https://grants.nih.gov/grants/guide/pa-files/PAR-19-330.html,,,9/9/2022,8/5/2019,,,Data Coordinating Center for Multi-Site Investigator-Initiated Clinical Trials (Collaborative U24 Clinical Trial Required),,Required_Infrastructure
['data sharing'],https://grants.nih.gov/grants/guide/pa-files/PAR-19-147.html,,,1/8/2022,1/8/2019,,,Drug Discovery For Nervous System Disorders (R01 Clinical Trials Not Allowed),,Not_Allowed
['data sharing'],https://grants.nih.gov/grants/guide/pa-files/PAR-19-184.html,,,5/8/2022,2/5/2019,,,Biology of Bladder Cancer (R21 Clinical Trial Optional),,Optional
['data sharing'],https://grants.nih.gov/grants/guide/pa-files/PAR-19-189.html,,,1/8/2022,2/21/2019,,,Pilot Services Research Grants Not Involving Clinical Trials (R34 Clinical Trial Not Allowed),,Not_Allowed
['data sharing'],https://grants.nih.gov/grants/guide/pa-files/PAR-19-193.html,,,5/8/2022,2/22/2019,,,Microbial-based Cancer Therapy -Bugs as Drugs (R01 Clinical Trial Not Allowed),,Not_Allowed
['data sharing'],https://grants.nih.gov/grants/guide/pa-files/PAR-19-194.html,,,5/8/2022,2/22/2019,,,Microbial-based Cancer Therapy -Bugs as Drugs (R21 Clinical Trial Not Allowed),,Not_Allowed
['data sharing'],https://grants.nih.gov/grants/guide/pa-files/PAR-19-198.html,,,11/9/2021,2/27/2019,,,Modulating Intestinal Microbiota to Enhance Protective Immune Responses against Cancer (R01 Clinical Trial Not Allowed),,Not_Allowed
['data sharing'],https://grants.nih.gov/grants/guide/pa-files/PAR-19-199.html,,,11/9/2021,2/27/2019,,,Modulating Intestinal Microbiota to Enhance Protective Immune Responses against Cancer (R21 Clinical Trial Not Allowed),,Not_Allowed
['data sharing'],https://grants.nih.gov/grants/guide/pa-files/PAR-19-202.html,,,11/3/2021,2/27/2019,,,"High impact, Interdisciplinary Science in NIDDK Research Areas (RC2 Clinical Trial Optional)",,Optional
['data sharing'],https://grants.nih.gov/grants/guide/pa-files/PAR-19-207.html,,,8/12/2022,3/4/2019,,,Alcohol and Other Substance Use Research Education Programs for Health Professionals (R25 Clinical Trial Not Allowed),,Not_Allowed
['data sharing'],https://grants.nih.gov/grants/guide/pa-files/PAR-19-212.html,,,3/24/2022,3/7/2019,,,Behavioral and Integrative Treatment Development Program (R01 Clinical Trial Optional),,Optional
['data sharing'],https://grants.nih.gov/grants/guide/pa-files/PAR-19-213.html,,,3/24/2022,3/7/2019,,,Behavioral and Integrative Treatment Development Program (R34 Clinical Trial Optional),,Optional
['data sharing'],https://grants.nih.gov/grants/guide/pa-files/PAR-19-214.html,,,2/23/2022,3/8/2019,,,Novel Assays to Address Translational Gaps in Treatment Development (UG3/UH3 Clinical Trial Optional),,Optional
['data sharing'],https://grants.nih.gov/grants/guide/pa-files/PAR-19-220.html,,,2/17/2022,3/13/2019,,,Clinical Trial Readiness for Rare Neurological and Neuromuscular Diseases (U01 Clinical Trial Not Allowed),,Not_Allowed
['data sharing'],https://grants.nih.gov/grants/guide/pa-files/PAR-19-231.html,,,5/8/2022,3/29/2019,,,NEI Clinical Research Study Planning Grant Program (R34 Clinical Trial Not Allowed),,Not_Allowed
['data sharing'],https://grants.nih.gov/grants/guide/pa-files/PAR-19-234.html,,,5/8/2022,4/2/2019,,,Limited Competition: Additional Sequencing for the Alzheimer's Disease Sequencing Project (U01 Clinical Trial Not Allowed),,Not_Allowed
['data sharing'],https://grants.nih.gov/grants/guide/pa-files/PAR-19-235.html,,,5/8/2022,4/2/2019,,,Reducing the Duration of Untreated Psychosis in the United States (R34 Clinical Trial Required),,Required
['data sharing'],https://grants.nih.gov/grants/guide/pa-files/PAR-19-236.html,,,5/8/2022,4/2/2019,,,Reducing the Duration of Untreated Psychosis in the United States (R01 Clinical Trial Required),,Required
['data sharing'],https://grants.nih.gov/grants/guide/pa-files/PAR-19-185.html,,,1/26/2022,2/12/2019,,,Initiative to Maximize Research Education in Genomics: Courses (R25 Clinical Trial Not Allowed),,Not_Allowed
['data sharing'],https://grants.nih.gov/grants/guide/pa-files/PAR-19-183.html,,,5/8/2022,2/5/2019,,,Biology of Bladder Cancer (R01 Clinical Trial Optional),,Optional
['data sharing'],https://grants.nih.gov/grants/guide/pa-files/PAR-19-239.html,,,9/7/2022,4/4/2019,,,Clinical Research to Improve the Oral Health of Older Adults (R01 Clinical Trial Not Allowed),,Not_Allowed
['data sharing'],https://grants.nih.gov/grants/guide/pa-files/PAR-19-173.html,,,5/8/2022,1/29/2019,,,Achieving Tissue Robustness Through Harnessing Immune System Plasticity (R21 Clinical Trial Not Allowed),,Not_Allowed
['data sharing'],https://grants.nih.gov/grants/guide/pa-files/PAR-19-149.html,,,1/8/2022,1/8/2019,,,Exploratory/Developmental Bioengineering Research Grants (EBRG) (R21 Clinical Trial Not Allowed),,Not_Allowed
['data sharing'],https://grants.nih.gov/grants/guide/pa-files/PAR-19-150.html,,,1/8/2022,1/8/2019,,,Exploratory/Developmental Bioengineering Research Grants (EBRG) (R21 Clinical Trial Optional),,Optional
['data sharing'],https://grants.nih.gov/grants/guide/pa-files/PAR-19-151.html,,,1/8/2022,1/8/2019,,,NIDCR Dentist Scientist Career Transition Award for Intramural Investigators (K22 Independent Basic Experimental Studies with Humans Required),,Basic_Trial
